{"artifact_digests":{"cases/phase15-runtime-v1/development.jsonl":"e82258ab878dee7172b06de978a1d4b20b19a724e04bf86e816b80e0ae4e53ee","cases/phase15-runtime-v1/holdout.jsonl":"178569d20494c3437f3b41010e32f0b31feb3e06f2900c8b9d3281ff7f8c0a68","cases/phase15-runtime-v1/validation.jsonl":"9106412b385dfab32a2f1d59d14552a06970d406072d51bdf28457d7125dda45","labels/phase15-runtime-v1/development.jsonl":"b9d325bffe3360d67f6dc9f11daf97f4f90e2585f5ad8c9a0f5c3408e8eefec2","labels/phase15-runtime-v1/holdout.jsonl":"d071e6c1b7384b5055ae21cd7518efb870472a6b1c0b33079ec39e21669d14ca","labels/phase15-runtime-v1/validation.jsonl":"a9b841f29808b08e3e9ab718169f67a65f18c4eb8906f705da6cf91df8a2d64b"},"case_digests":{"phase15-live-development-001":"8b24215196f8547649cb2768169b0584254104434a5ddc2b00f81c6a0fe48958","phase15-live-development-002":"d9ca3934eb26e7ab65363c85c79abe6b8935f9f8de38e746fee1a7d64b214234","phase15-live-development-003":"8c2ffab9bb4217c6c825fcc35ad6c55a7962b14b81069271259cb423b9667dec","phase15-live-development-004":"24fee1a07957bf9145179c7734edb5029dc8e1418e4045d56159294940236b9c","phase15-live-holdout-001":"45df13ff31630b9cf7c264b1beab5bbc4001c6b56c1fd7de20b8656256c65564","phase15-live-holdout-002":"c7cda28b2756c9428c951a14bf231f08fd252a883459ca126ebd22da0771a22f","phase15-live-holdout-003":"2460d4dd1414be9cf87dce5455fd3c6b762b535c48ffdee88e84a5105dea7159","phase15-live-holdout-004":"16270d0e6a5302139dcca03bca5dd469a8f07e6d28d72bde7d3e6738ac2fc0fa","phase15-live-validation-001":"ca0b45d9c434a74c5c509385151fa805fbdd9bb2dfb255e8595b196fa34fa6c7","phase15-live-validation-002":"2685e901c53148cfa040d3ae34375be9005950051cf99e2ce631f2c707868140","phase15-live-validation-003":"50518d10abb2c603a2efd5089f78c5be62f7f64e2f3df815d23daa694f519236","phase15-live-validation-004":"2ba7c193682328689bba5ac3069d516c03c7ff5522388709ed5935e0a927ebd5","phase15-live-validation-005":"f1fc8f8a79af50631fccafc6b47888c3f6d63d1f55328b4427e1692d4a35f594","phase15-live-validation-006":"a40526210627cab8c149503abecf9796f95c2cc88f4793a07becf4492ba622fe","phase15-live-validation-007":"e3415e786fba8ea90a9459112940c2c5e67267ddd74d06dfe14f470eb293fa33","phase15-live-validation-008":"78e765b84bbe16d0ada66f5b94bbf941a4fdb37f93093ee6907e38162ec1d75d","phase15-prepare-development-001":"3031f477913e74b3d74d2c8db6fd8008dbeb799b9c9ee13701d50d9b9412b1fe","phase15-prepare-holdout-001":"63cc059d8006649b56efd3b9bb86b6fa6b4a091075f1a5d13bd62a417cebd09f","phase15-prepare-validation-001":"7ce37e7cde3b079217746899c78e3d87426c8ec88ca2699a1f0945a051d4953a","phase15-prepare-validation-002":"2350d514abfc29055f906293bca0c4be4095ae839a7191a67794f05d89329862","phase15-review-development-002":"14ca248d843859654bbab579e4ee9aa2ffa724b761c3f57d8a9f672de5c3870f","phase15-review-holdout-002":"e1cef9beebe1c9be027aa7a0be1ed505366ff1dd5ffbf35adddddf424ca0ae0b","phase15-review-validation-003":"d60cb421d8d84be00611be361b37f17af4e93ce04aadd917029f1e74c0a15210","phase15-review-validation-004":"47a4530f275812422786bf6e3a5a7c306d1d4579aecb51dc69f7dc432e47d05d","phase15-runtime-event-development-001":"41188c97f21d885a4b41e55f4184b632057bffdac4ba08ad153d0fa4e8579e52","phase15-runtime-event-development-002":"8102776f852d00e8ae1bdb94608139dd6b0066f082885ea4627c12af6bf990e7","phase15-runtime-event-holdout-007":"52e6b1d96a4a81f62b446c3d106480fa7f65cbe5ce932b7bb36955d3847115e0","phase15-runtime-event-holdout-008":"f66af55303741cdd8dae1f2b0abde39ff4133a2bd0734f83e6af0671e770f5b2","phase15-runtime-event-validation-003":"b50f4cb87bee5ffeb4b48fdfa894aa98b3c8ad1abfe632dc624a833cfe0e21de","phase15-runtime-event-validation-004":"f3014766dc600dbdc9acb0527b3dc8de478ba9df66e4a933b91300156d7a9473","phase15-runtime-event-validation-005":"abffa4cd1b696e506200fbc780a9eaefb50bca2517372c87e65cad092477fb33","phase15-runtime-event-validation-006":"9246deb6a4a9141866248c7bc537d6233db96766ad1eb2e4e4ac6bdef79568de","phase15-runtime-plan-development-001":"10cb9264def68a000a9f321645975515148c42b75152f09868e374d3e7434f73","phase15-runtime-plan-development-002":"8034566389bf7fad0b5b96e2e1162a9fda390c59f2a7f8f2c8b89153020ce696","phase15-runtime-plan-holdout-007":"06d95e6ad1e1eca712633750d252e2ff49555a194608e69eb5af9dc3b3e3e976","phase15-runtime-plan-holdout-008":"5585874bb7c18cc835f4ab76f6ae77f77abd30cb2f4124ecb92b28833c8c449e","phase15-runtime-plan-validation-003":"78d0513422f6e6bf4a32b75126545b9d4821d4836415d6bee3576a5d9709cba5","phase15-runtime-plan-validation-004":"7aec4189017f413eb9a2fedecbca9d757455877e2f752f300625e6477dfdf516","phase15-runtime-plan-validation-005":"c4b0dd38ba007b4a9a5957e4cb8f3519e11e67cc03ac91f77de5dd27c6805321","phase15-runtime-plan-validation-006":"9be6e4bd57b2797a6f53662c5379977d3f7e1c92a404dc835ba8aca122a0cbe3","phase15-runtime-skill-development-001":"fe763d2c59c711216dd20bb01d6781d5827391df9a80d20ee97010437bcaa484","phase15-runtime-skill-development-002":"c2b01309f7cb573ab4d00153f7852adf9a475a014acdb5355712c3ff8126314f","phase15-runtime-skill-holdout-007":"9537f02f06f03fbd59fdfdc98f95f59985bad68da3ecfa247a34fd13afd43be7","phase15-runtime-skill-holdout-008":"1d571d47f5129c7822db123656e6cad8f4d2976665d5570df62b9db4b7fe3429","phase15-runtime-skill-validation-003":"e160e72965e9c698903bb4c8b8fbcd981ae886bf090be3a087105ca8385e949f","phase15-runtime-skill-validation-004":"ccccee5bc8bafdac34b0ae0bd866771ab3b57ae1361808bf9c0905f0ca30d6b7","phase15-runtime-skill-validation-005":"a7b4506ba0988d7beb7b1dc86e0c65085e08a4298cd7d0b3192cb00d252bf3ae","phase15-runtime-skill-validation-006":"c8c49f0397de6f314ac21335acf1f6c5af63b70fe6332d82890b9d3b3cfdaa94"},"case_ids":{"development":["phase15-runtime-skill-development-001","phase15-runtime-skill-development-002","phase15-runtime-plan-development-001","phase15-runtime-plan-development-002","phase15-runtime-event-development-001","phase15-runtime-event-development-002","phase15-live-development-001","phase15-live-development-002","phase15-live-development-003","phase15-live-development-004","phase15-prepare-development-001","phase15-review-development-002"],"holdout":["phase15-runtime-skill-holdout-007","phase15-runtime-skill-holdout-008","phase15-runtime-plan-holdout-007","phase15-runtime-plan-holdout-008","phase15-runtime-event-holdout-007","phase15-runtime-event-holdout-008","phase15-live-holdout-001","phase15-live-holdout-002","phase15-live-holdout-003","phase15-live-holdout-004","phase15-prepare-holdout-001","phase15-review-holdout-002"],"validation":["phase15-runtime-skill-validation-003","phase15-runtime-skill-validation-004","phase15-runtime-skill-validation-005","phase15-runtime-skill-validation-006","phase15-runtime-plan-validation-003","phase15-runtime-plan-validation-004","phase15-runtime-plan-validation-005","phase15-runtime-plan-validation-006","phase15-runtime-event-validation-003","phase15-runtime-event-validation-004","phase15-runtime-event-validation-005","phase15-runtime-event-validation-006","phase15-live-validation-001","phase15-live-validation-002","phase15-live-validation-003","phase15-live-validation-004","phase15-live-validation-005","phase15-live-validation-006","phase15-live-validation-007","phase15-live-validation-008","phase15-prepare-validation-001","phase15-prepare-validation-002","phase15-review-validation-003","phase15-review-validation-004"]},"dataset_digest":"19d4a4a2a8b7a8ae80f34d833fad522b7bd518bede4026009fa482dc7b48cffc","domain_counts":{"LIVE":16,"PREPARE":4,"REVIEW":4,"RUNTIME_EVENT":8,"RUNTIME_PLAN":8,"RUNTIME_SKILL":8},"generator_digest":"9f9272245d4461f31cfb019d72430458c6804e0770c22741c382acc5293e1828","manifest_digest":"1dd5b4a29d2b4c9c0d3a81a570a2e6bc0aeddfba4841982acf156b6f5044af25","manifest_id":"phase15-runtime-v1","manifest_version":"1.0.0","rules_digest":"cd36733a770dd8f7aca70a9bd034583c038a23a90f265cb70c69eb99d4a091ff","schema_digest":"15ed3073c366add86a0a3cae6075df154ecb2aa27e2ff05252616c29e503dab8","seed":20260718,"source_code_digest":"bd4100f2d75b4b1847c6cfdbc8671c57d21d9566bde9ea05c02507dea0b22a6b","source_manifest_digests":{"phase13-v3":"ec81d9bbed5836c6ab8b4348c2ff755cac27d283af99d6e5ba7806d71942b817","phase14-human-support-v1":"d5d1ddca65f8d8ccfd5b156e49fb32c431065f0bda7558ab926625b2f04028af"},"supersedes":["phase13-v3","phase14-human-support-v1"]}
